{
  "schema_version": "tscb.measurement-protocol.v3.2",
  "profile": "STEADY_PROCESS",
  "outer_repetitions": 5,
  "encode_min_ns": 100000000,
  "decode_min_ns": 100000000,
  "max_trial_wall_ns": 30000000000,
  "max_total_wall_ns": 600000000000,
  "warmup_min_count": 3,
  "warmup_min_ns": 100000000,
  "max_inner_iterations": 1000000,
  "max_retries": 0,
  "start_method": "spawn",
  "worker_initial_state": "FRESH_INTERPRETER",
  "timing_scope": "PIPELINE",
  "estimand": "DIRECTION_NS_PER_INDEPENDENT_OBJECT",
  "clock": "PERF_COUNTER_NS",
  "context_policy": "FRESH_ENCODE_AND_DECODE_CONTEXT_PER_OBJECT",
  "cache_policy": "WARM_INPUT_OS_CACHE_UNCONTROLLED",
  "cold_start_boundary": null,
  "collector_mode": "ENABLED",
  "thread_monitor_interval_ns": null,
  "stop_mode": "FIXED_REPETITIONS",
  "min_outer_repetitions": 1,
  "precision_relative_halfwidth": null,
  "precision_checkpoints": [],
  "confidence_level": "0.95",
  "sequential_method": null,
  "max_noise_cv": "0.10",
  "pilot_repetitions": 7,
  "pilot_seed": 0,
  "min_clock_signal_ratio": 100,
  "max_harness_fraction": "0.05",
  "max_collector_fraction": "0.15",
  "max_load_1m": null,
  "max_temperature_c": null,
  "max_throttle_ratio": null,
  "require_environment_observations": false,
  "retry_policy": "FAILED_ATTEMPTS_ONLY_RETAIN_ALL",
  "exclusion_policy": "PREDECLARED_CORRECTNESS_RESOURCE_AND_ENVIRONMENT_GATES",
  "protocol_id": "v2:measurement-protocol-v32:sha256:1d9c53df1085957f937894af3b18a7bc6bf4c3a7c62bafae7b2b5132f297ab67"
}
